{
  "scenario_id": "PCAP-001",
  "protocol": "SMTP",
  "tls_presence": "implicit-TLS",
  "starttls_integrity": "N/A",
  "tls_version": "1.3",
  "cipher_strength": "HIGH",
  "cert_validity": "valid",
  "cert_chain_shape": "complete-chain",
  "cert_sig_algo": "ECDSA",
  "hostname_match": "matched",
  "auth_outcome": "post-TLS-encrypted",
  "expected_starttls_status": "IMPLICIT_TLS",
  "expected_trust_status": "TRUSTED_CHAIN",
  "layer": "inventory",
  "port_type": "standard",
  "expected_protocol": "SMTP",
  "tls13_kex_mode": "ECDHE",
  "forward_secrecy": true,
  "hello_retry_request": false,
  "downgrade_sentinel": "none",
  "sig_alg_cert_present": false,
  "cert_has_san": true,
  "hostname_type": "dns",
  "certificate_observable": "ENCRYPTED"
}